aiter/ops/triton/configs/gemm/MI350X-GEMM-A8W8_BLOCKSCALE-N=5120-K=2048.json
{
  "small": {
    "BLOCK_SIZE_M": 16,
    "BLOCK_SIZE_N": 64,
    "BLOCK_SIZE_K": 128,
    "GROUP_SIZE_M": 1,
    "matrix_instr_nonkdim": 16,
    "num_warps": 4,
    "num_stages": 1,
    "waves_per_eu": 8,
    "cache_modifier": ".cg",
    "NUM_KSPLIT": 1
  },
  "medium_M32": {
    "BLOCK_SIZE_M": 8,
    "BLOCK_SIZE_N": 128,
    "BLOCK_SIZE_K": 128,
    "GROUP_SIZE_M": 8,
    "num_warps": 8,
    "num_stages": 4,
    "waves_per_eu": 2,
    "matrix_instr_nonkdim": 16,
    "cache_modifier": ".ca",
    "NUM_KSPLIT": 1
  },
  "medium_M64": {
    "BLOCK_SIZE_M": 8,
    "BLOCK_SIZE_N": 128,
    "BLOCK_SIZE_K": 128,
    "GROUP_SIZE_M": 8,
    "num_warps": 8,
    "num_stages": 4,
    "waves_per_eu": 2,
    "matrix_instr_nonkdim": 16,
    "cache_modifier": ".ca",
    "NUM_KSPLIT": 1
  },
  "medium_M128": {
    "BLOCK_SIZE_M": 8,
    "BLOCK_SIZE_N": 128,
    "BLOCK_SIZE_K": 128,
    "GROUP_SIZE_M": 8,
    "num_warps": 8,
    "num_stages": 4,
    "waves_per_eu": 2,
    "matrix_instr_nonkdim": 16,
    "cache_modifier": ".ca",
    "NUM_KSPLIT": 1
  },
  "medium_M2000": {
    "BLOCK_SIZE_M": 64,
    "BLOCK_SIZE_N": 256,
    "BLOCK_SIZE_K": 128,
    "GROUP_SIZE_M": 4,
    "NUM_KSPLIT": 1,
    "num_warps": 4,
    "num_stages": 1,
    "waves_per_eu": 2,
    "matrix_instr_nonkdim": 32,
    "cache_modifier": ".ca"
  },
  "medium_M6017": {
    "BLOCK_SIZE_M": 128,
    "BLOCK_SIZE_N": 128,
    "BLOCK_SIZE_K": 128,
    "GROUP_SIZE_M": 9,
    "matrix_instr_nonkdim": 32,
    "num_warps": 4,
    "num_stages": 1,
    "waves_per_eu": 0,
    "cache_modifier": null,
    "NUM_KSPLIT": 1
  },
  "any": {
    "BLOCK_SIZE_M": 128,
    "BLOCK_SIZE_N": 128,
    "BLOCK_SIZE_K": 128,
    "GROUP_SIZE_M": 4,
    "num_warps": 2,
    "num_stages": 2,
    "waves_per_eu": 1,
    "matrix_instr_nonkdim": 32,
    "cache_modifier": null,
    "NUM_KSPLIT": 1
  }
}